id,submission_time,view_number,vote_number,title,message,image
1,2017-04-09 10:30:54.953115,42,7,Wordpress loading multiple jQuery Versions,Wordpress loading multiple jQuery Versions :edit,
2,2019-04-09 10:53:54.953115,17,3,Your title                                ,Enter your Question here                                                                                                                                            ,
3,2019-04-11 08:59:54.719914,37,6,How to blow an elephant,How to blow an elephant :V,
694beee7-aaf8-41cb-92ce-4e3adec9ae2e,2019-04-26 08:26:56.579346,0,1,Your title,Enter your Question here,
fcea3ed9-282c-4d93-8f6c-e0bca326146a,2019-04-26 08:27:11.432387,0,2,Your title,Enter your Question here,
5fbf6c90-d314-40d3-a12b-a95892200a0f,2019-04-26 08:30:45.593302,0,0,Your title,jgc,
8a2268c1-54b4-4e49-99ed-95e80a1a4a0e,2019-04-26 09:14:01.349558,8,7,pancakes,pancakes,
